poi_id,name,region,locality,address,postcode,longitude,latitude,category_level1,category_level2,category_level3,business_status,phone,website_domain,rating,rating_count,traffic_score,time_spent,update_month
e8d6e0a0d69dbf33b0920b087fcf8b77,Jotun Multicolor Center,Dammam Metropolitan Area,Al Qatif,"Uhud Rd, Ar Rawdah, Al Qatif 32625, Saudi Arabia",32625,50.04295664,26.57361375,Retail & Shopping,Construction & Hardware,Paint store,Open,+966 59 729 1676,jotun.com,4.0,75.0,57.17,People typically spend up to 25 min here,03-2025
0b16458148d3f6ac265a75c364d8f1de,صيدلية الدواء,Aseer Province,Abha,"طريق المحالة العام, Almahalah, Abha 62549, Saudi Arabia",62549,42.58967647,18.27446646,Retail & Shopping,Drug & Pharma,Pharmacy,Open,+966 800 244 4444,al-dawaa.com,3.8,177.0,35.57,People typically spend up to 15 min here,03-2025
af64977fd2192e2456cfff1a4c7a41c3,أسواق حمد,Riyadh Province,Riyadh,"Al Hair Branch Rd, Ad Dar Al Baida, Riyadh 14519, Saudi Arabia",14519,46.75859936,24.55679967,Retail & Shopping,Market & Grocers,Grocery store,Open 24 hours,+966 11 213 3215,nahdi.sa,3.7,290.0,35.71,People typically spend up to 2 hours here,03-2025
256244ec42bec8ab7afcb64e580d923d,Abar Water Hail,Hail Province,Hail,"Hail 55423, Saudi Arabia",55423,41.74216941,27.48963637,Retail & Shopping,Shopping Centers,Shopping mall,Open,+966 53 138 1037,noran.sa,4.2,48.0,43.0,People typically spend up to 1 hour here,03-2025
2867e82c8cff182ef6fcac480b95c7e1,مجوهرات قمة زاوية الشفاء للذهب,Umm Al Hamam Al Gharbi,Riyadh,"8190, Riyadh 12327, Saudi Arabia",12327,46.64693318,24.69451576,Retail & Shopping,Arts & Crafts,Jewelry store,Open,+966 11 480 3038,q-alshefa.com,4.7,907.0,56.83,People typically spend up to 3 hours here,03-2025
d1a72bde6f880c74606e95da31070ffc,Al Deffi Center الدفي سنتر,Eastern Province,Al Jubail,"Deffi, الشهداء 5أ،, Al Jubail 35816, Saudi Arabia",35816,49.51821279,27.13155272,Retail & Shopping,Shopping Centers,Shopping mall,Open,+966 13 340 7428,kinan.com.sa,3.9,246.0,69.14,People typically spend up to 30 min here,03-2025
1fec1b867dba9507c193056b61f2b17b,بتلاند | Petland,Jeddah,Jeddah,"6493 احمد العطاس، AZ Zahra District, Jeddah 23521 3397, Jeddah 23521, Saudi Arabia",23521,39.12895814,21.59487263,Retail & Shopping,Pet Supplies,Pet store,Open,+966 9200 11973,petland.shop,4.2,1575.0,59.86,People typically spend up to 30 min here,03-2025
c69400a70ed9582f619381ac8573cf37,صيدلية الدواء,Makkah Province,الطائف,"شارع الملك فهد الروضة الخرمة، الطائف 29353, Saudi Arabia",29353,42.02231736,21.91418529,Retail & Shopping,Drug & Pharma,Pharmacy,Open,+966 800 244 4444,al-dawaa.com,4.4,32.0,44.57,People typically spend up to 25 min here,03-2025
d68867b01120087aea9fdfec8d494b44,صيدلية الدواء,Riyadh Province,Riyadh,"الندوة، شارع الحارث بن عبدالله, Riyadh 14813, Saudi Arabia",14813,46.8625112,24.79563842,Retail & Shopping,Drug & Pharma,Pharmacy,Open 24 hours,+966 800 244 4444,al-dawaa.com,4.3,60.0,33.43,People typically spend up to 4 hours here,03-2025
5b8e3c745781078afe5e71b5b4360453,بوابة البزورية جدة - منتجات سورية وتركية,Jeddah,Jeddah,"Al Imam Abdul Aziz, Al Faisaliyyah, Jeddah 23442, Saudi Arabia",23442,39.17290788,21.56949527,Retail & Shopping,Market & Grocers,Gourmet grocery store,Open,+966 55 093 1175,facebook.com,4.2,260.0,45.86,People typically spend up to 25 min here,03-2025
a6dd13a00a3d4a1d4ca27cd3a9165792,أسواق التميمي,Riyadh Province,Riyadh,"Elegant Centre، 3467 Al Jamiah St, Al Malaz, 3429, Riyadh 12642, Saudi Arabia",12642,46.72732015,24.66212195,Retail & Shopping,Market & Grocers,Grocery store,Open 24 hours,+966 800 303 0010,tamimimarkets.com,4.2,1024.0,58.43,People typically spend up to 30 min here,03-2025
01be4f7cd4a158b7ee55c336d5da0892,Al Yarmouk Plaza,Riyadh Province,Riyadh,"Al Yarmuk, Unnamed Road, Riyadh 13243, Saudi Arabia",13243,46.76722197,24.81167148,Retail & Shopping,Shopping Centers,Shopping mall,Open,+966 11 207 5500,unified.com.sa,4.1,96.0,56.29,People typically spend up to 1 hour here,03-2025
dcdfd181d632fae56537c3493f5106e9,BLV MALL,Jeddah,Jeddah,"5967 King Abdulaziz Branch Rd, Ash Shati, Jeddah 23414, Saudi Arabia",23414,39.12272023,21.5696189,Retail & Shopping,Shopping Centers,Shopping mall,Open,+966 800 100 0212,amam.sa,4.3,4432.0,52.14,People typically spend up to 1 hour here,03-2025
65d5a22ed054d397e8f2bb2a71abdbbb,Aldawaa Pharmacy,Dammam Metropolitan Area,Al Khobar,"بن عبدالعزيز, Al Aqrabiyah, شارع الأمير حمود, Al Khobar 34446, Saudi Arabia",34446,50.1966295,26.29309636,Retail & Shopping,Drug & Pharma,Pharmacy,Open,+966 800 244 4444,al-dawaa.com,4.4,58.0,47.71,People typically spend up to 1 hour here,03-2025
642a49f54efe1a98245d8a6c912cb1c1,Al HARBI & ALDHIAA Supermarket,Riyadh Province,Riyadh,"Al Urubah Rd, As Sulimaniyah, Riyadh 12245, Saudi Arabia",12245,46.68285615,24.71775119,Retail & Shopping,Shopping Centers,Supermarket,Open 24 hours,+966 11 217 1777,alharbistores.com,3.9,2905.0,52.0,People typically spend up to 20 min here,03-2025
442a1f48d48eb8a99aa24d054b317987,اكسترا - eXtra,Taif,Taif,"2046 طريق الشفا، السداد 26514 6599،, Taif 26514, Saudi Arabia",26514,40.40853882,21.23267189,Retail & Shopping,Computers & Electronics,Electronics store,Open,+966 800 124 0900,extra.com,3.8,1399.0,59.29,People typically spend up to 45 min here,03-2025
07547e6e0850847af1f0b000d78c2374,Alrimaya الرماية لتجهيزات الصيد والرحلات,Al Bahah Province,Baljurashi,"King Abdulaziz Rd, Baljurashi 65648, Saudi Arabia",65648,41.5631608,19.89012875,Retail & Shopping,Outdoor & Sporting,Camping store,Open,+966 17 724 0182,alrimaya.com,3.9,319.0,49.57,People typically spend up to 1 hour here,03-2025
8192a209e40303831257abf35f27ed95,SMSA Service Center,Aseer Province,Khamis Mushait,"Al Jazirah, Khamis Mushait 62461, Saudi Arabia",62461,42.72723293,18.31381749,Retail & Shopping,Packaging & Shipping,Shipping and mailing service,Open,+966 9200 09999,smsaexpress.com,3.6,1352.0,63.29,People typically spend up to 30 min here,03-2025
37eecb0ad42a28a3cd197965030221fd,صيدلية الدواء,Eastern Province,Al Hofuf,"حي, King Abdullah Road, Al Mazrooa, Al Hofuf 36362, Saudi Arabia",36362,49.61117376,25.33710044,Retail & Shopping,Drug & Pharma,Pharmacy,Open,+966 800 244 4444,al-dawaa.com,3.5,116.0,43.71,People typically spend up to 30 min here,03-2025
98e4a60d3fb7705a642d7eacf1e60c8f,Smsa Express Warehouse Hail,Hail Province,Hail,"King Abdulaziz Rd, Hail 55414, Saudi Arabia",55414,41.79855418,27.46343446,Retail & Shopping,Packaging & Shipping,Shipping and mailing service,Open,+966 16 571 0209,smsaexpress.com,3.5,167.0,46.86,People typically spend up to 1.5 hours here,03-2025
42d03328fc632cf9194a32b3423b7af7,Panda,Tabuk Principality,Tabuk,"King Abdulaziz Rd, Alaziziyah Aljadidah, Tabuk 47911, Saudi Arabia",47911,36.57215922,28.38006568,Retail & Shopping,Shopping Centers,Supermarket,Open,+966 9200 27707,panda.com.sa,3.9,3386.0,47.71,People typically spend up to 45 min here,03-2025
72c1459049ab9384137082354b9adbec,صيدلية الدواء,Riyadh Province,Riyadh,"متفرقات, شارع الملك عبدالعزيز الصقورية المزاحمية, Riyadh 19671, Saudi Arabia",19671,46.28301844,24.47533433,Retail & Shopping,Drug & Pharma,Pharmacy,Open,+966 800 244 4444,al-dawaa.com,3.6,55.0,37.14,People typically spend up to 15 min here,03-2025
20bd9efb3f6a7110a510024ec6fe155e,صيدلية الدواء,Riyadh Province,Al-Kharj,"King Salman Bin Abdulaziz Rd, Al Faysaliyah, Al-Kharj 16441, Saudi Arabia",16441,47.3476413,24.1637063,Retail & Shopping,Drug & Pharma,Pharmacy,Open,+966 800 244 4444,al-dawaa.com,4.0,54.0,43.29,People typically spend up to 10 min here,03-2025
679308bd2735bc2787ae77d599ec905a,United Pharmacy - صيدلية المتحدة,Taif,Taif,"Al Muthna, Al Mathnah, Taif 26511, Saudi Arabia",26511,40.39361798,21.26249138,Retail & Shopping,Drug & Pharma,Pharmacy,Open,+966 800 244 4445,unitedpharmacy.sa,3.4,30.0,43.43,People typically spend up to 15 min here,03-2025
316917532e774dc5fcb7dd9f7fd1b9f5,Viola Flowers & Gifts,Al Madinah Province,Madinah,"سعد بن عثمان، مذينب، 42364, Saudi Arabia",42364,39.67209219,24.44711653,Retail & Shopping,Flowers & Gifts,Florist,Open,+966 59 533 4422,instagram.com,4.1,191.0,32.86,People typically spend up to 45 min here,03-2025
cc82b8a180d4df12605b891ff35f865d,"شركة الأخشاب العالمية International Timber Company-ITCO, Madinah",Al Madinah Province,Madinah,"2560، 7139, Madinah 42346, Saudi Arabia",42346,39.66451323,24.59698381,Retail & Shopping,Construction & Hardware,Lumber store,Open,+966 55 443 5341,itco-sa.com,4.0,38.0,67.0,People typically spend up to 45 min here,03-2025
dbc3e11603f69ea2a8ba6953b3a1ace6,معرض عبدالرحمن عماد الدين للسيارات,Riyadh Province,Riyadh,"Wadi Ad Dawasir, Al Qadisiyyah, Riyadh 14223, Saudi Arabia",14223,46.83157038,24.82914224,Retail & Shopping,Auto & Vehicle Retail,Car dealer,Open,+966 55 004 5067,emadalden.com,4.1,598.0,59.0,People typically spend up to 30 min here,03-2025
249436ae7644f9a08255987d74b49626,اللعبة السريعة للالعاب,Dammam Metropolitan Area,Dammam,"جملة الالعاب، شارع 12،شارع, Al Souq, Dammam 32241, Saudi Arabia",32241,50.10072584,26.44209215,Retail & Shopping,Toys & Games,Toy store,Open,+966 56 529 7902,newspeed7.com,4.3,77.0,42.71,People typically spend up to 4 hours here,03-2025
530ca54a582ae50e31f18ac24976305a,شركة الناصر للإنارة | Alnasser Company‎,Riyadh Province,Riyadh,"8094 Al Muhsin Al Baghdadi, Al Malaz, Riyadh 12842, Saudi Arabia",12842,46.74416545,24.65798692,Retail & Shopping,Home & Furniture,Lighting store,Open,+966 50 156 9630,alnasser.com,4.2,217.0,53.83,People typically spend up to 1.5 hours here,03-2025
6f0cc9932f3c1d5bf5d50fe567a9bcce,حلقة الفواكة والخضار,Aseer Province,Al Namas,"9743 Al Omar St, Alfaisaliyah، AIAB4537، 4537, Al Namas 67387, Saudi Arabia",67387,42.13993636,19.14768995,Retail & Shopping,Market & Grocers,Fruit and vegetable store,Open,+966 17 282 0341,balady.gov.sa,3.6,1040.0,57.0,People typically spend up to 25 min here,03-2025
2c3c78f3c8abcfba7cb98b5689b47ff2,King Khaled Eye Specialist Hospital & Research Centre مستشفى الملك خالد التخصصي للعيون ومركز الأبحاث,Umm Al Hamam Al Gharbi,Riyadh,"Al Urubah Rd, Umm Al Hamam Al Gharbi, Riyadh 11462, Saudi Arabia",11462,46.63361482,24.69447154,Retail & Shopping,Eyewear & Optics,Eye care center,Open 24 hours,+966 11 482 1234,kkesh.med.sa,4.1,1607.0,50.57,People typically spend up to 3.5 hours here,03-2025
528b28db2ee5211d6e229878959a12f6,عبايات لفتة - فرع الباحة الحاوية,Al Bahah Province,Al Bahah,"شارع, Alhawiyah, Al Bahah 65525, Saudi Arabia",65525,41.46483044,20.01715985,Retail & Shopping,Fashion & Accessories,Clothing store,Open,+966 9200 33702,laftah.com,4.1,44.0,41.71,People typically spend up to 30 min here,03-2025
4ba7f60e001302529c5148349ba228bf,صيدلية الدواء,Eastern Province,Khafji,"King Abdullah Road, الكيلو, Khafji 39262, Saudi Arabia",39262,48.48279572,28.4731043,Retail & Shopping,Drug & Pharma,Pharmacy,Open,+966 800 244 4444,al-dawaa.com,4.5,48.0,46.0,People typically spend up to 30 min here,03-2025
85f973d189b8f10f5397cc87fd240443,Sakhr Stationery,Al Madinah Province,Madinah,"Hussain Ibn Al Muali, Ar Ranuna, Madinah 42392, Saudi Arabia",42392,39.59367817,24.39075897,Retail & Shopping,Office & Stationery,Stationery store,Open,+966 59 790 3223,sakhr.com,4.1,414.0,46.43,People typically spend up to 25 min here,03-2025
ad119dc3abe73cf6db2d9c6cc83dd72a,صيدلية ليمون | Lemon Pharmacy,Riyadh Province,Riyadh,"7219 Al Bahar Al Ahmar St, Al Wadi, Riyadh 13313, Saudi Arabia",13313,46.68901958,24.78837189,Retail & Shopping,Drug & Pharma,Pharmacy,Open 24 hours,+966 9200 13770,lemon.sa,3.5,57.0,42.43,People typically spend up to 3 hours here,03-2025
958568ec6a1b5038f492f45e5f0ac5e6,"MAN - Showroom, Service, & Parts",Riyadh Province,Riyadh,"8386 Kharis Branch Rd, An Nasim Al Gharbi، 3157, Riyadh 14232, Saudi Arabia",14232,46.81246689,24.74694177,Retail & Shopping,Auto & Vehicle Retail,Truck dealer,Open,+966 9200 11305,hha.com.sa,4.5,101.0,61.5,People typically spend up to 4 hours here,03-2025
a34d16ef4b34cfa7fbd4358a92cb7225,SMSA Service Center,Sultanah,Riyadh,"Sultanah, Riyadh 11564, Saudi Arabia",11564,46.68462787,24.59843931,Retail & Shopping,Packaging & Shipping,Shipping and mailing service,Open,+966 9200 09999,smsaexpress.com,3.2,311.0,63.83,People typically spend up to 45 min here,03-2025
bd6ec303e78d6a4a6ef143175d73eb20,صيدلية الدواء,Eastern Province,Al Hofuf,"شارع الثلاثين حي السليمانية الاول, Al Hofuf 36421, Saudi Arabia",36421,49.55265454,25.3674824,Retail & Shopping,Drug & Pharma,Pharmacy,Open,+966 800 244 4444,al-dawaa.com,3.6,44.0,41.14,People typically spend up to 15 min here,03-2025
c931a91878697bd64a1470fe779cc8f2,صيدلية الدواء,Eastern Province,Al Hofuf,"بن عبدالعزيز, طريق الأمير نايف, Al Hofuf 36362, Saudi Arabia",36362,49.58543786,25.3444869,Retail & Shopping,Drug & Pharma,Pharmacy,Open,+966 800 244 4444,al-dawaa.com,3.1,24.0,48.71,People typically spend up to 1.5 hours here,03-2025
c4b2afa43b53789f7f65e4714cb971ae,Top Center,Yanbu,Yanbu,"طریق عثمان بن عفان، البحر، ٦٤٢٤, Yanbu 46424, Saudi Arabia",46424,38.05812918,24.09356595,Retail & Shopping,Shopping Centers,Shopping mall,Open,+966 9200 31931,topcenter.com.sa,3.9,3118.0,63.71,People typically spend up to 1 hour here,03-2025
f85e58dfaa9b056fbd5bfd0bb601c763,متجر ساعات- CASIO,Jeddah,Jeddah,"Al Mawared Alleyway, Al-Balad, Jeddah 22233, Saudi Arabia",22233,39.1801024,21.48642511,Retail & Shopping,Computers & Electronics,Electronics store,Open,+966 53 434 1091,axo-sa.com,4.1,55.0,35.83,People typically spend up to 30 min here,03-2025
27e132533a32cd32b9df9c5d9e9ca69a,Khomasiyaat خماسيات,Jeddah,Jeddah,"Al Murjan, Jeddah 23714, Saudi Arabia",23714,39.10336615,21.68899341,Retail & Shopping,Shopping Centers,Shopping mall,Open,+966 56 022 1011,sameeraaziz-group.com,4.0,30.0,37.86,People typically spend up to 1.5 hours here,03-2025
c2216cd1afbc468119961cbbe0df4933,درعه DERAAH,Eastern Province,Al Hofuf,"Alfardus, Al Hofuf 36368, Saudi Arabia",36368,49.6396922,25.36556092,Retail & Shopping,Perfume & Cosmetics,Perfume store,Open,+966 800 118 6666,deraahstore.com,4.3,349.0,60.14,People typically spend up to 1.5 hours here,03-2025
3eaa8d6c81ebd177bb6fa5bb65a5a7dd,صيدلية الدواء,Riyadh Province,Riyadh,"Al Sahel Valley, حي الرمال, Riyadh 13254, Saudi Arabia",13254,46.80242468,24.84310163,Retail & Shopping,Drug & Pharma,Pharmacy,Open,+966 800 244 4444,al-dawaa.com,3.4,75.0,46.43,People typically spend up to 1 hour here,03-2025
d165348d81f5bf6b7e237d2e5365c153,الهرم بلازا,Tabuk Principality,Tabuk,"King Abdulaziz Rd, Al Salihiyyah, Tabuk 47913, Saudi Arabia",47913,36.55019852,28.39241131,Retail & Shopping,Shopping Centers,Shopping mall,Open,+966 14 423 0690,alharamplaza.com,3.9,3435.0,35.0,People typically spend up to 45 min here,03-2025
c810920aa3fcfdff29ebddf27c0ab38b,Advanced Motors for Auto parts,Jeddah,Jeddah,"Sultan Ibn Salman, Al Marwah, Jeddah 23542, Saudi Arabia",23542,39.18432745,21.62405771,Retail & Shopping,Auto & Vehicle Retail,Auto parts store,Open,+966 9200 31515,advmotors.sa,4.0,730.0,65.43,People typically spend up to 45 min here,03-2025
9e458ceba6386aaf0fa769253afda28e,تموينات خيرات الجواد للمواد الغذائية,Dammam Metropolitan Area,Al Qatif,"3420 Uhud Rd, Ar Rawdah, Al Qatif 32619, Saudi Arabia",32619,50.0333737,26.57245069,Retail & Shopping,Shopping Centers,Supermarket,Open,+966 54 300 5295,instagram.com,4.4,143.0,65.0,People typically spend up to 20 min here,03-2025
48e1616d6040daf066d8a7cdbf71d0a1,jotun paints,Dammam Metropolitan Area,Dammam,"Prince Mohammed St, Al Souq, Dammam 32242, Saudi Arabia",32242,50.09410041,26.44022223,Retail & Shopping,Construction & Hardware,Paint store,Open,+966 53 745 0502,jotun.com,4.1,132.0,67.86,People typically spend up to 1.5 hours here,03-2025
912a2842ae9fcae5ed9376ce4cc97b27,alhussain toys,Riyadh Province,Riyadh,"Al Takhassousi, Al Olaya, Riyadh 12331, Saudi Arabia",12331,46.66641252,24.69809735,Retail & Shopping,Toys & Games,Toy store,Open,+966 59 470 6740,alhussaintoys.net,3.8,756.0,43.29,People typically spend up to 1 hour here,03-2025
8783724fce48b150ad5b2d9df082cd9c,صيدلية الدواء,Riyadh Province,Riyadh,"شارع سلمان الفارسي, Al Khaleej, Riyadh 13224, Saudi Arabia",13224,46.81393379,24.75530296,Retail & Shopping,Drug & Pharma,Pharmacy,Open,+966 800 244 4444,al-dawaa.com,3.4,70.0,64.57,People typically spend up to 4 hours here,03-2025
0206edc64822853d5527eba3faf099ef,Almaha Optical,Riyadh Province,Riyadh,"Khalid Ibn Al Walid St, Ar Rawdah, Riyadh 13213, Saudi Arabia",13213,46.76749598,24.75253684,Retail & Shopping,Eyewear & Optics,Optician,Open,+966 9200 33390,almahaopt.com,4.1,622.0,51.14,People typically spend up to 4 hours here,03-2025
19ef6749a5aae0abc2d99994f62eece6,مؤسسة احمد عمر احمد باعبدالله للتجارة,Riyadh Province,Riyadh,"طريق الخرج - مجمع الوسط التجاري, Riyadh 04288, Saudi Arabia",04288,46.73254521,24.63199171,Retail & Shopping,Construction & Hardware,Tool wholesaler,Open,+966 11 405 2483,selvertools.com,4.4,27.0,49.5,People typically spend up to 45 min here,03-2025
d8c1cfee7094782da6b8f3c34424c82a,Nahdi pharmacy | صيدليه النهدى,Eastern Province,Ras Tanura,"Ad Danah, Ras Tanura رحيمة, Saudi Arabia",رحيمة,50.06348278,26.70344224,Retail & Shopping,Drug & Pharma,Pharmacy,Open,+966 9200 24673,nahdionline.com,4.6,172.0,46.29,People typically spend up to 25 min here,03-2025
0d4dbae0263a96bbdd16c966aaa6bbdc,معرض ال ظاهر للملابس الجاهزه,Dammam Metropolitan Area,Al Qatif,"7370 Al Khalifah Omar St, 7370، 2431 شارع الخليفة عمر، المنطقة المركزية، القطيف‎ 32636, Al Qatif 32636, Saudi Arabia",32636,49.99819084,26.55767511,Retail & Shopping,Fashion & Accessories,Clothing store,Open,+966 55 588 5114,instagram.com,4.6,102.0,57.0,People typically spend up to 2.5 hours here,03-2025
483869684cbfe976c7f36d121074621a,Almaha Optical,Makkah Province,Makkah,"2133، 7145 قصر الضيافة، النزهة، مكة 24221, Makkah 24221, Saudi Arabia",24221,39.7878572,21.43269243,Retail & Shopping,Fashion & Accessories,Sunglasses store,Open,+966 9200 33390,almahaopt.com,4.3,134.0,58.0,People typically spend up to 4 hours here,03-2025
9d414bfeefb0f7ea4bff5213e6d06c24,Al-Dawaa Pharmacy,Riyadh Province,Riyadh,"Dammam Rd, Ghirnatah, Riyadh 13242, Saudi Arabia",13242,46.74031251,24.80067195,Retail & Shopping,Drug & Pharma,Pharmacy,Open,+966 800 244 4444,al-dawaa.com,3.9,135.0,41.71,People typically spend up to 20 min here,03-2025
a917e4f00c1f10bda293426def2877f4,Centrepoint,Jeddah,Jeddah,"Ground Floor, Jeddah 23447،, Saudi Arabia",23447،,39.19452811,21.57666792,Retail & Shopping,Big Box & Department Stores,Department store,Open,+966 800 111 1027,centrepointstores.com,3.4,541.0,26.14,People typically spend up to 1.5 hours here,03-2025
370fec047fab6c8a06388d89bfd55eb0,Danube | الدانوب,Jeddah,Jeddah,"سعود الفيصل،, Al Khalidiyyah, Jeddah 23423, Saudi Arabia",23423,39.13221882,21.55963229,Retail & Shopping,Shopping Centers,Supermarket,Open 24 hours,+966 800 244 2225,danube.sa,4.3,6736.0,63.29,People typically spend up to 30 min here,03-2025
a12fb2865da0dcb51dd65056a39c5f29,صيدلية المجتمع الرائدة 17,Jeddah,Jeddah,"Prince Abdallah Al Sharbatli, Al-Safa, Jeddah 23454, Saudi Arabia",23454,39.22077673,21.58525269,Retail & Shopping,Drug & Pharma,Pharmacy,Open,+966 9200 08144,online.almujtama.com.sa,4.0,97.0,54.86,People typically spend up to 20 min here,03-2025
ea6539b80e80e14fe3c4466282e37342,مكتبة أبجد هوز للطباعة والقرطاسية ABC Bookstore,Dammam Metropolitan Area,Al Khobar,"10th St, Al Aqrabiyah, Al Khobar 31952, Saudi Arabia",31952,50.19307619,26.29067766,Retail & Shopping,Office & Stationery,Stationery store,Open,+966 53 895 5555,abcbookstore.sa,4.2,227.0,52.0,People typically spend up to 1 hour here,03-2025
e7712e165029e48a45c4b117ce13d6e4,زينكو - مستودع مدينة جازان,Jazan Province,Jazan,"7808 طريق عثمان بن عفان، جازان 82528 4040،, Jazan 82528, Saudi Arabia",82528,42.7017252,16.80922697,Retail & Shopping,Home & Furniture,Lighting store,Open,+966 800 301 8000,zincoint.com,4.3,30.0,39.0,People typically spend up to 3 hours here,03-2025
b574d3e8a1123d4c44f12ea570e3659f,Nahdi,Aseer Province,Ahad Rafidah,"15, As Salamah, Ahad Rafidah 62419, Saudi Arabia",62419,42.8236759,18.18300618,Retail & Shopping,Drug & Pharma,Pharmacy,Open 24 hours,+966 17 250 9674,nahdi.sa,3.7,110.0,38.86,People typically spend up to 30 min here,03-2025
a8fed61409954c61722c453285c66dcb,Jotun Paints,Riyadh Province,Riyadh,"Al Takhassousi, Al Olaya, Riyadh 11429, Saudi Arabia",11429,46.67158252,24.68793215,Retail & Shopping,Construction & Hardware,Paint store,Open,+966 57 237 8688,jotun.com,3.8,141.0,52.67,People typically spend up to 2 hours here,03-2025
909072bf93e6ef749f3774c730802da0,الغلام للتجميل والعطور,Eastern Province,Al Mubarraz,"شارع سوق الذهب, Al Shuabah, Al Mubarraz 36341, Saudi Arabia",36341,49.58683924,25.41214438,Retail & Shopping,Cosmetics & Beauty,Cosmetics store,Open,+966 54 990 8575,alghulam2.com,4.3,463.0,71.86,People typically spend up to 30 min here,03-2025
dc8ab0bc486ee55f48886c1079c711e0,دهانات الجزيرة - Jazeera Paints,Eastern Province,Al Hofuf,"6648 Al Muzruiyyah, Almuallimeen, Al Hofuf 36361, Saudi Arabia",36361,49.57652345,25.36689669,Retail & Shopping,Construction & Hardware,Paint store,Open,+966 800 123 1233,jazeerapaints.com,4.0,40.0,60.17,People typically spend up to 2 hours here,03-2025
cbd09df308d7f91c2bfa69fc083201ca,REDTAG,Taif,Taif,"Shehar, Shihar, Taif 26311, Saudi Arabia",26311,40.40676324,21.25975615,Retail & Shopping,Fashion & Accessories,Clothing store,Open,+966 800 304 3113,redtagfashion.com,4.0,1846.0,40.71,People typically spend up to 45 min here,03-2025
10c3ab643e356ab7ef2d95133a7306e0,Junaid Jashmed J.,Dammam Metropolitan Area,Al Khobar,"2303، 7769 طريق الملك فيصل الكورنيش الخبر 34411 2303, Saudi Arabia",2303,50.21130636,26.33154082,Retail & Shopping,Fashion & Accessories,Clothing store,Open,+966 58 131 0001,junaidjamshed.com,3.9,636.0,31.14,People typically spend up to 1.5 hours here,03-2025
0fb28c495bd79ecf1398b4b0ec868490,القاضي الطبية,Riyadh Province,Riyadh,"Prince Abdulaziz Ibn Musaid Ibn Jalawi St, Al Murabba, Riyadh 12612, Saudi Arabia",12612,46.70361122,24.66854855,Retail & Shopping,Medical Supplies,Medical supply store,Open,+966 11 266 1229,alkedi-medical.com,4.4,66.0,49.86,People typically spend up to 2 hours here,03-2025
93770384fc1cef8e73d42c68c50aa754,صيدلية الدواء,حي المساعدية الشرقية,Arar,"King Abdulaziz Road, Almosaediah, Arar 73311, Saudi Arabia",73311,41.01303693,30.96977546,Retail & Shopping,Drug & Pharma,Pharmacy,Open 24 hours,+966 800 244 4444,al-dawaa.com,3.7,55.0,49.71,People typically spend up to 15 min here,03-2025
74932e306a2780ee903fea2158999476,Almajed For Oud - HQ,Riyadh Province,Riyadh,"4299 King Abdulaziz Rd, As Sahafah, Riyadh 13321, Saudi Arabia",13321,46.64326191,24.81444255,Retail & Shopping,Perfume & Cosmetics,Perfume store,Open,+966 9200 20088,almajed4oud.com,4.1,389.0,40.14,People typically spend up to 4 hours here,03-2025
af07a72901e1794857a09b935002f3ed,Farm Superstores 31,Sudayr,Al Jubail,"Al Jubail 35811, Saudi Arabia",35811,49.5619828,27.12969278,Retail & Shopping,Shopping Centers,Supermarket,Open,+966 9200 12507,farm.com.sa,3.8,457.0,59.43,People typically spend up to 25 min here,03-2025
e511674699d8df9b340fb398e47c6a88,دار ايمن,Jeddah,Jeddah,"Sari Br Rd, Al Khalidiyyah, Jeddah 23424, Saudi Arabia",23424,39.13670971,21.57310717,Retail & Shopping,Vintage & Thrift,Vintage clothing store,Open,+966 55 564 1436,darayman.sa,4.4,282.0,41.29,People typically spend up to 45 min here,03-2025
39fdc450bde3c112df6ed3152bb2f046,Ghalyoun,Dammam Metropolitan Area,Safwa,"Al Rabwah، شارع الصحابي علي بن أبي طالب رضي الله عنه, Safwa 32828, Saudi Arabia",32828,49.95009338,26.65853966,Retail & Shopping,Tobacco & Vape,Tobacco shop,Open,+966 13 825 4449,ghalyoun.com.sa,4.3,356.0,59.14,People typically spend up to 1 hour here,03-2025
0959a38eede66f13b3889c950cd84b0b,Danube | الدانوب,Jeddah,Jeddah,"An Nahdah, شارع حراء،, Jeddah 23523, Saudi Arabia",23523,39.12897727,21.6099837,Retail & Shopping,Shopping Centers,Supermarket,Open,+966 800 244 2225,danube.sa,4.3,9839.0,65.14,People typically spend up to 30 min here,03-2025
eaca4692cc14ec1b430957866f020c3c,Max,Eastern Province,Al Hofuf,"Prince Mohammed Bin Abdulaziz Rd, Almubarakiyah, Al Hofuf 36364, Saudi Arabia",36364,49.61377517,25.37446864,Retail & Shopping,Fashion & Accessories,Clothing store,Open,+966 800 111 1629,maxfashion.com,4.0,1051.0,43.86,People typically spend up to 30 min here,03-2025
682cfe4c812a753edcbd21510efe683a,Al Raya #03- Sari - الراية,Jeddah,Jeddah,"Sari Br Rd، STREET، Ar Rawdah, Jeddah 23434, Saudi Arabia",23434,39.16076912,21.57973164,Retail & Shopping,Shopping Centers,Supermarket,Open,+966 53 470 6497,alraya.com.sa,4.0,4556.0,59.57,People typically spend up to 30 min here,03-2025
