poi_id,name,region,locality,address,postcode,longitude,latitude,category_level1,category_level2,category_level3,business_status,phone,website_domain,rating,rating_count,traffic_score,time_spent,update_month
8cb3ff1df8e6025d0d5221486ab71cda,اسواق النخبة ( الثلاجة العالمية ),Shuran,Madinah,"9139 Salah Adin Al Ayubi Rd، حي شوران، DMUJ4510، 4510, Madinah 42386, Saudi Arabia",42386,39.63272612,24.39551959,Retail & Shopping,Shopping Centers,Supermarket,Open,+966 55 546 9689,universalcsc.com,3.5,47.0,34.29,People typically spend up to 20 min here,03-2025
970d4ce039f43dca5e032328aaccb910,محل ورد نواعم للورد الاجاويد🌹🌹,Jeddah,Jeddah,"Alajaweed, Jeddah 22443, Saudi Arabia",22443,39.29716922,21.39894736,Retail & Shopping,Shopping Centers,Shopping mall,Open,+966 50 087 8681,instagram.com,4.7,34.0,54.86,People typically spend up to 30 min here,03-2025
7f9e3853b65678501e5251e38f12648c,Royal Pharmacy صيدلية رويال,Dammam Metropolitan Area,city,"2537 حي, Mayyas, 6989 شارع الامام علي بن ابي طالب, EGGB6989, city 32636, Saudi Arabia",32636,49.99929114,26.55444582,Retail & Shopping,Drug & Pharma,Pharmacy,Open,+966 58 191 3794,instagram.com,4.9,30.0,46.29,People typically spend up to 3 hours here,03-2025
d24d56796a0aecbe76bbb89f9e75a89e,نظارات السلمان | AlSalman Optics,Dammam Metropolitan Area,Dammam,"حي, Anas Ibn Malik St, Az Zuhur, Dammam 32423, Saudi Arabia",32423,50.08599532,26.45856232,Retail & Shopping,Eyewear & Optics,Optician,Open,+966 9200 01999,alsalmanoptics.com,4.8,214.0,37.29,People typically spend up to 3 hours here,03-2025
e77ba9a30ee6e8c464775710a6432683,Ocean Pharmacy 44,Riyadh Province,Riyadh,"Ad Dar Al Baida, HR76+264 الدار البيضاء، الرياض شارع الياقوت Ad Dar Al Baida Dist, Riyadh 14516, Saudi Arabia",14516,46.80798229,24.56256715,Retail & Shopping,Drug & Pharma,Pharmacy,Open 24 hours,+966 56 909 7241,oceanpharmacy.sa,4.6,14.0,34.0,People typically spend up to 20 min here,03-2025
1cd69b120f119fe2bbfc7adf82265745,LuLu Hypermarket - Saihat,Dammam Metropolitan Area,Saihat,"3917 6744 Al Musib Ibn Rafi, Al Muntazah, Saihat 32452, Saudi Arabia",32452,50.0450145,26.4871386,Retail & Shopping,Big Box & Department Stores,Hypermarket,Open,+966 800 100 0330,luluhypermarket.com,4.3,2308.0,50.29,People typically spend up to 45 min here,03-2025
25df069422974392e139cc98e39e1725,اسواق العثيم (سيتي) | Othaim Markets (city)‏,Riyadh Province,Afif,"5160 رفاعة البدري, Al Sulaymaniyah، LAGB8312، 8312, Afif 17531, Saudi Arabia",17531,42.9110161,23.91643665,Retail & Shopping,Shopping Centers,Supermarket,Open,+966 9200 00702,othaimmarkets.com,4.1,28.0,47.57,People typically spend up to 25 min here,03-2025
daac595a936e8641e05e72ee5cd004ae,Golden Pet,Jeddah,Jeddah,"JENB6838 3943 Amna Bint Wahb St, Al Naeem, Jeddah 23621, Saudi Arabia",23621,39.14211118,21.63000269,Retail & Shopping,Pet Supplies,Pet supply store,Open,+966 56 647 0597,goldenpetsa.com,4.9,179.0,36.43,People typically spend up to 30 min here,03-2025
7226d7141a29ce980586a771d341e068,AlSadhan Supermarket Rabwa‎,Riyadh Province,Riyadh,"4978 Umar Ibn Abdul Aziz Br Rd, Ar Rabwah, 7066, Riyadh 12816, Saudi Arabia",12816,46.74990234,24.68855189,Retail & Shopping,Shopping Centers,Supermarket,Open,+966 9200 00546,al-sadhan.com,4.2,910.0,49.0,People typically spend up to 45 min here,03-2025
465ba7fbc3f8e9225bb96f87ae008e2a,MG Motor - Showroom - Riyadh Sulimaniyah - Jiad Modern Motors شركة جياد الحديثة للسيارات,Riyadh Province,Riyadh,"King Abdulaziz Rd, As Sulimaniyah, Riyadh 12243, Saudi Arabia",12243,46.70523581,24.70899537,Retail & Shopping,Auto & Vehicle Retail,Motor vehicle dealer,Open,+966 800 244 0390,mg-sa.com,4.3,227.0,41.17,People typically spend up to 45 min here,03-2025
8c310ea3b6e6354c560c0dd63c9a42b7,The A Market 102,Riyadh Province,Riyadh,"As Suwaidi، RBSA4642، 6841, Riyadh 12787, Saudi Arabia",12787,46.66723255,24.58881789,Retail & Shopping,Shopping Centers,Supermarket,Open,+966 9200 14457,amarkets.com.sa,4.5,44.0,39.43,People typically spend up to 45 min here,03-2025
77128042ed8f7325ad041898a4c60048,Dukan | الدكان,Al Madinah Province,Madinah,"4200 بسبس بن عمرو, Ar Ranuna, Madinah 42394, Saudi Arabia",42394,39.59917448,24.37883681,Retail & Shopping,Market & Grocers,Grocery store,Open,+966 55 802 8855,dukan.me,3.0,50.0,40.29,People typically spend up to 15 min here,03-2025
3e21c58ff0603f3e810079430ef6e7fa,Dukan | الدكان,Al Madinah Province,Madinah,"Ar Ranuna, Madinah 42392, Saudi Arabia",42392,39.59134882,24.39362449,Retail & Shopping,Market & Grocers,Grocery store,Open,+966 55 802 8855,dukan.me,3.2,35.0,42.86,People typically spend up to 15 min here,03-2025
840e75d1c5358e7121157d6ae4d4b74d,شركة سيارتك للسيارات,Riyadh Province,Riyadh,"شارع وادي الخضر, Al Qadisiyyah, Riyadh 13261, Saudi Arabia",13261,46.82553521,24.83124374,Retail & Shopping,Auto & Vehicle Retail,Car dealer,Open 24 hours,+966 56 239 6700,syaratc.online,4.9,371.0,51.57,People typically spend up to 3.5 hours here,03-2025
1662bf5a11d4ef6c90aece3e71393bae,العاصمة للمنتجات البلاستيكية والمنظفات,Riyadh Province,Riyadh,"Asir St, Dhahrat Laban, Riyadh 13782, Saudi Arabia",13782,46.5532136,24.63431844,Retail & Shopping,Shopping Centers,Shopping mall,Open,+966 50 054 9890,alaasimah.com,4.1,188.0,56.43,People typically spend up to 30 min here,03-2025
2692d38a6f05f6d6c5c25849be97f9be,Dkhoon AlEmirates - دخون الإماراتية,Riyadh Province,Riyadh,"Al Aziziyah, 8589 Southern Ring Branch Rd, RMAB3993, 3993, Riyadh 14512, Saudi Arabia",14512,46.75410782,24.60431782,Retail & Shopping,Perfume & Cosmetics,Perfume store,Open,+966 9200 02360,dkhoonemirates.com,4.4,133.0,44.14,People typically spend up to 45 min here,03-2025
e0866241a52991ce7c19920eeaaa5335,Mejdaf,Al Madinah Province,Madinah,"2774 Prince Abd Al Mouhsen Abd Al Aziz, Qurban, Madinah 42316, Saudi Arabia",42316,39.61405119,24.45608835,Retail & Shopping,Computers & Electronics,Electronics store,Open,+966 50 093 4802,mejdaf.com,4.5,34.0,64.33,People typically spend up to 2 hours here,03-2025
b95cc8107f6ec70a907bc89aa9139056,صيانة عبداللطيف جميل للأجهزة الألكترونية,Riyadh Province,Riyadh,"امام سعود, Al Muruj, Riyadh 12263, Saudi Arabia",12263,46.65467362,24.74591843,Retail & Shopping,Computers & Electronics,Electronics store,Open,+966 800 127 9999,redsea.com,2.1,439.0,49.6,People typically spend up to 2.5 hours here,03-2025
c304d34a172197c5602d5fb9a749f246,التويجري للمستلزمات الرجالية,Dammam Metropolitan Area,Dammam,"3789 8511 Umar Ibn Al Khattab, Al Faysaliyah, Dammam 32272, Saudi Arabia",32272,50.05808156,26.40541851,Retail & Shopping,Fashion & Accessories,Men's clothing store,Open,+966 53 585 9333,altuwijri.com,3.6,560.0,48.14,People typically spend up to 25 min here,03-2025
a3ea967b4c69c94259128aed476af5a5,REDTAG,Al Qassim Province,Buraydah,"مركز العمري, Abu Bakr As Siddiq Rd, Al Iskan, Buraydah 52211, Saudi Arabia",52211,43.93629141,26.39330044,Retail & Shopping,Fashion & Accessories,Men's clothing store,Open,+966 16 324 5620,redtagfashion.com,3.6,87.0,29.57,People typically spend up to 45 min here,03-2025
2dd038c8f34edc07451e53aa8176ab56,شركة الناب المضيء التجارية NAB LED,Jeddah,Jeddah,"Palestine، تقاطع، طريق الملك فهد, Jeddah 21445, Saudi Arabia",21445,39.19022129,21.53449889,Retail & Shopping,Computers & Electronics,Electronics store,Open,+966 56 184 9049,nab-led.com,4.6,77.0,63.0,People typically spend up to 2 hours here,03-2025
3648434e2137ede1abebc6ab1bae19bb,شركة احمد باطهف هيونداي و تويوتا,Shuran,Madinah,"Umm Mani Asma Bint Amr Rd, Shuran, Madinah 42313, Saudi Arabia",42313,39.60667829,24.3990138,Retail & Shopping,Auto & Vehicle Retail,Auto parts store,Open,+966 50 625 1454,batahafco.sa,4.5,219.0,62.5,People typically spend up to 30 min here,03-2025
19ca2260462ce0271c7aa8f56b7a0b6d,نفذ للطباعة والدعاية والإعلان printing press,Riyadh Province,Riyadh,"Islamabad Street, Al Mansourah, Riyadh 12684, Saudi Arabia",12684,46.73505664,24.59630422,Retail & Shopping,Printing & Copy,Commercial printer,Open,+966 53 448 8122,instagram.com,4.9,188.0,40.0,People typically spend up to 1.5 hours here,03-2025
abed9587a37f439903caed7b8c4ff0c9,صيدلية ليمون | Lemon Pharmacy,Riyadh Province,Riyadh,"Al Hilla, Al Oud, Riyadh 12663, Saudi Arabia",12663,46.73062655,24.62912851,Retail & Shopping,Drug & Pharma,Pharmacy,Open,+966 9200 13770,lemon.sa,4.4,29.0,48.14,People typically spend up to 25 min here,03-2025
65b6b11799267271c6a9558cdec8e7e8,هاتفي ثري,Eastern Province,Al Mubarraz,"4291 طريق الأمير سعود الفيصل، حي الأندلس FMAC7839، 7839, Al Mubarraz 36341, Saudi Arabia",36341,49.59343066,25.40664973,Retail & Shopping,Computers & Electronics,Cell phone store,Open,+966 56 662 6841,store3three.com,4.7,416.0,52.14,People typically spend up to 1.5 hours here,03-2025
a89aad1bf01558832302db21b0504cee,Nahdi pharmacy | صيدليه النهدى,Middle East,Dumat al-Jandal,"حي, Al Rabwah, Dumat al-Jandal 74632, Saudi Arabia",74632,39.85737673,29.8088452,Retail & Shopping,Drug & Pharma,Pharmacy,Open,+966 9200 24673,nahdionline.com,4.0,45.0,45.0,People typically spend up to 20 min here,03-2025
8292b54c2203fe417225f3a46b3a3890,الأناناسة الذهبية,Riyadh Province,Riyadh,"حي، 6849 Prince Ahmad Ibn Abd Al Aziz, King Fahd، 3773, Riyadh 12272, Saudi Arabia",12272,46.67334677,24.73665016,Retail & Shopping,Shopping Centers,Shopping mall,Open,+966 56 190 0073,capncase.com,4.1,56.0,68.86,People typically spend up to 1 hour here,03-2025
ac64e72bce92173dbd3b4d6d603d6730,كيو اتش للأزياء -QH FASHION,Riyadh Province,Riyadh,"بجوار بلدية, Aktham Ibn Saifi, An Nasim Al Gharbi، حي, Riyadh 14233, Saudi Arabia",14233,46.82459551,24.72311249,Retail & Shopping,Fashion & Accessories,Women's clothing store,Open,+966 54 680 2521,salla.sa,4.6,224.0,59.43,People typically spend up to 45 min here,03-2025
aeeac6e79a48171d3526d0f183c9e45e,Libsi Markah,Dammam Metropolitan Area,Dammam,"الشاطئ، حي, 5247 Khaleej Rd, 8484،, Dammam 32414, Saudi Arabia",32414,50.12640978,26.45538381,Retail & Shopping,Fashion & Accessories,Clothing store,Open,+966 55 122 5563,libsimarkah.com,4.1,299.0,32.43,People typically spend up to 45 min here,03-2025
ac50e9aedb625232540c9a5558d220de,درعه DERAAH,Aseer Province,Abha,"Thirah, Abha 62521, Saudi Arabia",62521,42.50942562,18.20221094,Retail & Shopping,Perfume & Cosmetics,Perfume store,Open,+966 800 118 6666,deraahstore.com,4.0,276.0,33.29,People typically spend up to 20 min here,03-2025
ededf0f34d4f0cdf91edd0f2d4d60df8,صيدلية الدواء,Al Jowf Province,Al Qurayyat,"شارع المدينة المنورة، العزيزية, Al Qurayyat 77453, Saudi Arabia",77453,37.3588055,31.3352966,Retail & Shopping,Drug & Pharma,Pharmacy,Open,+966 800 244 4444,al-dawaa.com,4.1,20.0,42.29,People typically spend up to 15 min here,03-2025
c833a1a6154a3d8b3171e48f24448584,زهرة شوق,Riyadh Province,Riyadh,"Aktham Ibn Saifi, An Nasim Al Gharbi, Riyadh 11224, Saudi Arabia",11224,46.82512536,24.72321752,Retail & Shopping,Flowers & Gifts,Florist,Open,+966 50 931 0310,zahrtshuog.wixsite.com,4.5,82.0,51.0,People typically spend up to 2 hours here,03-2025
4bb17a2c9fd7c20b332d516de382b0c3,Farm Superstore اسواق المزرعة,Yanbu Al Sinaiyah,Yanbu,"3795 الوادي، ينبع الصناعية، 9070, ينبع 46452 2632+MH, Yanbu 46452, Saudi Arabia",46452,38.19885788,24.00419282,Retail & Shopping,Shopping Centers,Supermarket,Open,+966 9200 12507,farm.com.sa,3.8,1724.0,56.0,People typically spend up to 25 min here,03-2025
5160bbb089c7ef3342b21b2443c87c60,SMSA Express,Riyadh Province,Al Majma'ah,"Al Matar, Al Majma'ah 15362, Saudi Arabia",15362,45.37596029,25.92118134,Retail & Shopping,Packaging & Shipping,Shipping and mailing service,Open,+966 9200 09999,smsaexpress.com,3.1,505.0,47.83,People typically spend up to 1 hour here,03-2025
13a381812005f132a772e17ffb49be24,محل الأطلال لبيع الجوالات وصيانتها,Makkah Province,Makkah,"طريق الملك فيصل, Al Adel, Makkah 24244, Saudi Arabia",24244,39.85896162,21.44629481,Retail & Shopping,Computers & Electronics,Electronics store,Open,+966 55 397 1353,linktr.ee,4.2,417.0,39.71,People typically spend up to 1.5 hours here,03-2025
b4cfb874032963b5350c4eaeaef7ceaf,Al-Dawaa Pharmacy,Tuwaiq,Riyadh,"2305 خديجة بنت خويلد, Tuwaiq, Riyadh 14921, Saudi Arabia",14921,46.57631771,24.58373147,Retail & Shopping,Drug & Pharma,Pharmacy,Open,+966 800 244 4444,al-dawaa.com,3.7,92.0,49.14,People typically spend up to 15 min here,03-2025
216a379265dc5a5a43d20c9b0d2934f0,تموينات لذة الرمان لتجارة الأغذية والخضار والفواكه,Al Madinah Province,Madinah,"مقابل محطة الين، زرعة بن سيف بن ذي يزن, King Fahd, Madinah 42367, Saudi Arabia",42367,39.69938913,24.49130497,Retail & Shopping,Shopping Centers,Supermarket,Open 24 hours,+966 54 364 6329,lzt-alrman.com,4.5,67.0,30.0,People typically spend up to 2 hours here,03-2025
0afe6a1e43d9c1fff23fc9473e4e0b36,دوري الابطال للرياضة,Jeddah,Jeddah,"7399 حي الاجاويد، جدة 22443, Jeddah 22443, Saudi Arabia",22443,39.28972252,21.39912813,Retail & Shopping,Fashion & Accessories,Sportswear store,Open,+966 53 660 0456,instagram.com,4.8,389.0,63.0,People typically spend up to 30 min here,03-2025
07645212ccea28dab0de5ec0979fbf62,السلعة المميزة | وضيء,Riyadh Province,Riyadh,"Al Bayan, حي الفيحاء, Riyadh 14254, Saudi Arabia",14254,46.81173582,24.68082694,Retail & Shopping,Shopping Centers,Shopping mall,Open,+966 56 553 9595,alsslahalmmyzah.odoo.com,4.0,84.0,50.86,People typically spend up to 1 hour here,03-2025
355a5bbb20538c213726ced026ca8f07,Asyad,Jeddah,Jeddah,"Abdul Aziz Ibn Ibrahim, Al-Safa, Jeddah 23454, Saudi Arabia",23454,39.2219665,21.58022275,Retail & Shopping,Shopping Centers,Shopping mall,Open,+966 53 224 5551,snapchat.com,4.1,1507.0,75.43,People typically spend up to 2 hours here,03-2025
dc8a717ed2564dcd63728278ca6321bf,Louis Vuitton Riyadh Centria,Riyadh Province,Riyadh,"Olaya St, Al Olaya, Riyadh 12241, Saudi Arabia",12241,46.68084381,24.69791068,Retail & Shopping,Misc. Stores,Leather goods store,Open,+966 800 844 2842,me.louisvuitton.com,4.0,693.0,23.86,People typically spend up to 2 hours here,03-2025
e0111a955cbc8d8729d0e8ff919a938d,متجر العطاوي للإتصالات,Riyadh Province,Riyadh,"Al Sheikh Jaber Al Ahmad Al Sabah, Al Qadisiyyah, Riyadh 13252, Saudi Arabia",13252,46.7994389,24.81940248,Retail & Shopping,Computers & Electronics,Cell phone store,Open,+966 53 744 4601,aletawiksa.com,4.5,5043.0,57.71,People typically spend up to 30 min here,03-2025
fa284a4e505b67a9889c79800c5a817e,Al yemni motors co. Subaru chery donfeng,Jeddah,Jeddah,"Al Hayat, Mishrifah, Jeddah 23335, Saudi Arabia",23335,39.19784835,21.53395193,Retail & Shopping,Auto & Vehicle Retail,Subaru dealer,Open,+966 9200 00072,alyemnigroup.com,3.2,475.0,59.5,People typically spend up to 1 hour here,03-2025
3f3a307682307a1274dfbca3ff53997b,صيدلية الدواء,Eastern Province,Al Hofuf,"حي، طريق العقير, Al Shehabiyah, Al Hofuf 36365, Saudi Arabia",36365,49.61269735,25.36358711,Retail & Shopping,Drug & Pharma,Pharmacy,Open,+966 800 244 4444,al-dawaa.com,3.4,39.0,46.86,People typically spend up to 30 min here,03-2025
1cbb38c1d64a6440bb9074101443ad6c,Thamarat Alyaum,Dammam Metropolitan Area,Al Qatif,"Al Jarudiyah, Al Qatif 31911, Saudi Arabia",31911,49.98525717,26.54151932,Retail & Shopping,Market & Grocers,Fruit and vegetable store,Open,+966 13 854 3454,instagram.com,4.2,278.0,51.14,People typically spend up to 30 min here,03-2025
d10c19a1e3ee01438ad35cf20eeff693,مكتبة دار الجامعة,Al Qassim Province,Buraydah,"الهلال الأحمر،، جنوب دوار التعليم جنوب، طريق الملك عبد العزيز, Buraydah 52381, Saudi Arabia",52381,43.94710284,26.35802729,Retail & Shopping,Books & Comics,Book store,Open,+966 16 369 7774,aljameah.com,4.3,1058.0,52.67,People typically spend up to 25 min here,03-2025
b29fc0c712019f753f55990814fd6bc3,ثوب نورمان,Jeddah,Jeddah,"2701 An Naeem St, Al Naeem, Jeddah 23526, Saudi Arabia",23526,39.14186523,21.61913746,Retail & Shopping,Fashion & Accessories,Men's tailor,Open,+966 56 420 4020,instagram.com,4.6,423.0,55.71,People typically spend up to 45 min here,03-2025
1dc212e4a2eb31bcd2134c29b4184d63,شركة العلوان التجارية,Umkhraisan,Al Hofuf,"King Abdulaziz Rd, Umkhraisan, Al Hofuf 36361, Saudi Arabia",36361,49.58402694,25.39096563,Retail & Shopping,Auto & Vehicle Retail,Auto parts store,Open,+966 13 586 8210,alwanasp.com,4.0,1068.0,45.43,People typically spend up to 25 min here,03-2025
2af51a549be8f9fd833109c1602b978f,Almajed For Oud,Makkah Province,Al Qunfudhah,"King Abdulaziz, الجنوبية, Al Qunfudhah 28822, Saudi Arabia",28822,41.08078758,19.13367528,Retail & Shopping,Perfume & Cosmetics,Perfume store,Open,+966 9200 20088,almajed4oud.com,4.2,109.0,41.0,People typically spend up to 3 hours here,03-2025
a61c1467f8d772e26fe8263190f58439,صيدلية الدواء,Makkah Province,Makkah,"الشارع العام, At Taniem, ممشى, Makkah 24211, Saudi Arabia",24211,39.78467894,21.51209251,Retail & Shopping,Drug & Pharma,Pharmacy,Open,+966 800 244 4444,al-dawaa.com,4.0,181.0,56.0,People typically spend up to 15 min here,03-2025
01ac5e518d4eef8261ef1f852ab5b0ea,Qasr Al Saraya Furniture,Jeddah,Jeddah,"مستشفى عرفان, King Fahd Br Rd, Al Faisaliyyah, Jeddah 23442, Saudi Arabia",23442,39.1755584,21.57915341,Retail & Shopping,Home & Furniture,Furniture store,Open,+966 12 644 8080,qsf.sa,4.5,1124.0,55.86,People typically spend up to 1.5 hours here,03-2025
6ce4832e2182266df3f36c9d9e11ac05,أنا وفاكهتي,Dammam Metropolitan Area,Al Qatif,"Al Mutanabbi St, An Nassirah, Al Qatif 32641, Saudi Arabia",32641,50.00316442,26.57693475,Retail & Shopping,Market & Grocers,Fruit and vegetable store,Open,+966 53 307 7950,instagram.com,3.7,48.0,44.29,People typically spend up to 45 min here,03-2025
886c4530434d29ca4a4c1daaee917245,Asforh birds and ornamental fish,Eastern Province,Juatha,"Al Hulaylah، 7260 7260, Juatha 36348, Saudi Arabia",36348,49.66059671,25.43622234,Retail & Shopping,Pet Supplies,Pet store,Open,+966 56 764 2391,instagram.com,3.8,192.0,50.29,People typically spend up to 15 min here,03-2025
ba79599b7ebb8f551c655f2ddbbe24c8,على كيفك,Eastern Province,Hafar Al Batin,"6396 الملك عبد العزيز, Al Faisaliyah, Hafar Al Batin 39951, Saudi Arabia",39951,45.9596223,28.3820256,Retail & Shopping,Shopping Centers,Shopping mall,Open,+966 55 567 8003,alakaifak.com,4.1,1537.0,57.71,People typically spend up to 30 min here,03-2025
4674a86fbd5f49f80524a3746e923eec,لبسي ماركة - Libsi Markah,Riyadh Province,Riyadh,"طريقة الدائري الجنوبي, Al Mansourah، حي, Riyadh 12694, Saudi Arabia",12694,46.75408469,24.60563043,Retail & Shopping,Fashion & Accessories,Clothing store,Open,+966 9200 08375,libsimarkah.sa,4.0,2829.0,41.29,People typically spend up to 45 min here,03-2025
ebdde6735c2629ea17439ecbba6aa0da,الحازمي للاتصالات,Jeddah,Jeddah,"Palestine, Al Sharafeyah, Jeddah 21477, Saudi Arabia",21477,39.18324683,21.5302087,Retail & Shopping,Computers & Electronics,Cell phone store,Open,+966 56 433 7337,alhazmitelecom.sa,4.4,295.0,52.83,People typically spend up to 3.5 hours here,03-2025
4a70f3dc2de4a78ee106e630608b6b7b,Tamimi Markets Express,Riyadh Province,Riyadh,"6450 Kharis Branch Rd, 6450، 3664، Riyadh 13222, Saudi Arabia",13222,46.82166432,24.75436836,Retail & Shopping,Shopping Centers,Supermarket,Open 24 hours,+966 800 303 0010,tamimimarkets.com,4.1,2070.0,48.86,People typically spend up to 25 min here,03-2025
678825b48836f576dbbdb8a9a85783bb,صيدلية آي براند جملة الصيدليات,Al-takhasosy,Makkah,"Al Hamra Umm Al Jud, Makkah 24323, Saudi Arabia",24323,39.70637352,21.40121322,Retail & Shopping,Drug & Pharma,Pharmacy,Open,+966 55 228 8093,ibrand.com.sa,4.9,1200.0,51.29,People typically spend up to 10 min here,03-2025
c406d1aa035c95746445f01ba5962ace,شركه عالم المستهلك- فرع السلمانية,Eastern Province,Al Hofuf,"FHGA3962، 8218 طريق الأمير نايف، 3962, Al Hofuf 36441, Saudi Arabia",36441,49.56397898,25.34878628,Retail & Shopping,Shopping Centers,Shopping mall,Open,+966 53 977 7663,instagram.com,4.1,238.0,40.0,People typically spend up to 30 min here,03-2025
7a200b3eb8be7bf444b5eefef0c652f0,دار الفضة,Najran Province,Najran,"3788 King Faisal Rd, Najran 66271, Saudi Arabia",66271,44.19244819,17.52224569,Retail & Shopping,Shopping Centers,Shopping mall,Open,+966 50 605 7921,instagram.com,4.0,44.0,40.57,People typically spend up to 2 hours here,03-2025
2de852373b791173a7979ce076344816,صيدلية الدواء,Aseer Province,Bisha,"King Saud Rd, حي الخالدية, Bisha 67712, Saudi Arabia",67712,42.60463745,19.98828731,Retail & Shopping,Drug & Pharma,Pharmacy,Open,+966 800 244 4444,al-dawaa.com,4.0,33.0,30.57,People typically spend up to 2.5 hours here,03-2025
007efe627277f5885b0e19839bef6894,Day By Day,Jeddah,Jeddah,"Prince Sultan Rd, Al Zahra, Jeddah 23522, Saudi Arabia",23522,39.14059314,21.59948053,Retail & Shopping,Home & Furniture,Home goods store,Open,+966 50 792 2658,daybydayksa.com,4.1,735.0,46.29,People typically spend up to 2 hours here,03-2025
2492ce0b24b3d3af2919d4084e3ab471,شركة الفلاح للسيارات,Jeddah,Jeddah,"8345 2179 Al-Madinah Al-Munawarah Rd, Al Faisaliyyah, Jeddah 23442, Saudi Arabia",23442,39.16439472,21.5771208,Retail & Shopping,Auto & Vehicle Retail,Car dealer,Open,+966 11 826 0000,alfalahauto.com.sa,4.3,61.0,66.17,People typically spend up to 1 hour here,03-2025
e2deddf1f61f62006df4cd884ddcedbe,مستودع مهندس محمود عرفة السيراميك والبورسلان,Riyadh Province,Riyadh,"4729, 7279, Riyadh 14313, Saudi Arabia",14313,46.8105169,24.59856354,Retail & Shopping,Home & Furniture,Tile store,Open,+966 50 819 1330,biota.com.sa,4.9,7.0,43.0,People typically spend up to 45 min here,03-2025
76bf45a9bf4a840a16bff4c61f3e66f8,مطاحن الجود (مطاحن الحرمين سابقاً),Al Madinah Province,Madinah,"King Abdullah Branch Rd, Al Usayfirin, Madinah 42315, Saudi Arabia",42315,39.58571161,24.4579315,Retail & Shopping,Shopping Centers,Outlet mall,Open,+966 50 532 9922,aljoud-sa.com,4.1,82.0,62.43,People typically spend up to 30 min here,03-2025
53605114abead8df925cdd4e81943891,هيل وتمرة,Makkah Province,Makkah,"Batha Quraish, شارع عتاب إبن أسيد رضى الله عنه, Makkah 24362, Saudi Arabia",24362,39.82199567,21.35756371,Retail & Shopping,Market & Grocers,Gourmet grocery store,Open,+966 55 392 3545,heilwatamra.sa,4.6,55.0,49.57,People typically spend up to 30 min here,03-2025
e0896ffb08d0fb2161dc56fb1a2d48c2,صيدلية ادم 66 - العارض - الرياض,Riyadh Province,Riyadh,"Al Aarid, Riyadh 13342, Saudi Arabia",13342,46.62056762,24.86973231,Retail & Shopping,Drug & Pharma,Pharmacy,Open,+966 55 618 8944,adamonline.com,4.6,33.0,37.43,People typically spend up to 1.5 hours here,03-2025
4706133ffe70af34a7b83859d003403e,Nahdi pharmacy | صيدليه النهدى,Riyadh Province,Riyadh,"Abi Bakr As Siddiq Rd, An Narjis, Riyadh 13335, Saudi Arabia",13335,46.63747092,24.86800747,Retail & Shopping,Drug & Pharma,Pharmacy,Open,+966 9200 24673,nahdionline.com,4.3,103.0,33.57,People typically spend up to 1 hour here,03-2025
a6bdd4bfb456d874a23fe67eb105a70f,صيدلية الدواء,Riyadh Province,Riyadh,"حي, Dammam Rd, Al Munsiyah, الدائري الشمالي فرعي, Riyadh 13246, Saudi Arabia",13246,46.76881918,24.81410497,Retail & Shopping,Drug & Pharma,Pharmacy,Open,+966 800 244 4444,al-dawaa.com,3.5,17.0,35.29,People typically spend up to 2.5 hours here,03-2025
610190d82e1c5403b685f38400e9e5e6,United Pharmacy - صيدلية المتحدة,Riyadh Province,Riyadh,"2738 Al Sahaba Rd, Al Munsiyah, Riyadh 13255, Saudi Arabia",13255,46.76472058,24.83347359,Retail & Shopping,Drug & Pharma,Pharmacy,Open,+966 800 244 4445,unitedpharmacy.sa,4.2,22.0,45.71,People typically spend up to 45 min here,03-2025
86cf8218438bb7ed9a46776ef4cc01cb,Lemon pharmacy,Riyadh Province,Riyadh,"RRRC3428, 6348 الأمير خالد بن بندر بن عبدالعزيز, 3428, Riyadh 13338, Saudi Arabia",13338,46.6218817,24.87115254,Retail & Shopping,Drug & Pharma,Pharmacy,Open 24 hours,+966 11 207 7101,lemon.sa,3.1,26.0,29.57,People typically spend up to 3 hours here,03-2025
6203e81f1578fdd0091b4cba71d19f67,صيدلية الدواء,Riyadh Province,Riyadh,"حي, King Abdulaziz Rd, Al Aarid, Riyadh 13342, Saudi Arabia",13342,46.60793747,24.88385018,Retail & Shopping,Drug & Pharma,Pharmacy,Open,+966 800 244 4444,al-dawaa.com,3.8,67.0,56.43,People typically spend up to 15 min here,03-2025
e42630bb4fdd99494b722b2e2dda69cd,Al Dawaa Pharmacy,Northern Borders Province,Arar,"Abdulrahman Bin Abdulaziz St, Badanah، طريق الأمير سلطان, Arar 73312, Saudi Arabia",73312,41.00672025,30.98456978,Retail & Shopping,Drug & Pharma,Pharmacy,Open,+966 800 244 4444,al-dawaa.com,4.5,33.0,42.86,People typically spend up to 15 min here,03-2025
00d9725102c9cd211838edcd11699795,ALFAJR Watch - maintenance‎‎,Riyadh Province,Riyadh,"Olaya St, King Fahd, Riyadh 12271, Saudi Arabia",12271,46.66302218,24.73281092,Retail & Shopping,Fashion & Accessories,Watch store,Open,+966 11 210 8769,alfajr.com,4.4,179.0,36.71,People typically spend up to 1.5 hours here,03-2025
